author_flair_text,created_utc,downs,likes,name,no_follow,num_comments,score,selftext,title,ups,upvote_ratio,url,view_count,comments
Big Brother is Watching.,1301191327,2,,t3_gc9oh,,18,10,"Instead of visitors asking all the time, heres a list of things you should do when you're in Singapore. Sg redditors! Contribute to the list! I'll start! (It'll be nice if you could add in a Google Maps link as well)EDIT: Thanks for the contributions keep em coming!**Food*** [Chomp Chomp](http://maps.google.com.sg/maps?f=q&amp;source=s_q&amp;hl=en&amp;geocode=&amp;q=chomp&amp;aq=&amp;sll=-12.95296,-38.460768&amp;sspn=0.115098,0.167885&amp;ie=UTF8&amp;hq=&amp;hnear=Chomp+Chomp,+20+Kensington+Park+Rd,+Singapore,+557269&amp;ll=1.364249,103.86653&amp;spn=0.001845,0.002623&amp;z=19)* [Victor's Kitchen](http://maps.google.com.sg/maps?f=q&amp;source=s_q&amp;hl=en&amp;geocode=&amp;q=Victor's+Kitchen&amp;aq=0&amp;sll=1.29998,103.851&amp;sspn=0.029518,0.041971&amp;ie=UTF8&amp;hq=Victor's+Kitchen&amp;hnear=&amp;ll=1.300481,103.851013&amp;spn=0.028446,0.041971&amp;z=15&amp;iwloc=A)* [Beach Road Prawn Noodles](http://maps.google.com.sg/maps?f=q&amp;source=s_q&amp;hl=en&amp;geocode=&amp;q=Beach+Road+Prawn+Noodles&amp;aq=&amp;sll=1.359,103.818&amp;sspn=0.472278,0.671539&amp;ie=UTF8&amp;hq=Beach+Road+Prawn+Noodles&amp;hnear=&amp;ll=1.366982,103.818054&amp;spn=0.455115,0.671539&amp;z=11&amp;iwloc=A)* [Changi Village Hawker Center](http://maps.google.com.sg/maps?f=q&amp;source=s_q&amp;hl=en&amp;geocode=&amp;q=Changi+Village+Hawker&amp;aq=&amp;sll=1.366982,103.818054&amp;sspn=0.455115,0.671539&amp;ie=UTF8&amp;hq=Village+Hawker&amp;hnear=Changi,+Singapore&amp;ll=1.382684,103.971176&amp;spn=0.056889,0.083942&amp;z=14&amp;iwloc=A)* [Lau Pa Sat](http://maps.google.com.sg/maps?f=q&amp;source=s_q&amp;hl=en&amp;geocode=&amp;q=Lau+Pa+sat&amp;aq=t&amp;sll=1.359,103.818&amp;sspn=0.571126,1.056747&amp;ie=UTF8&amp;hq=Lau+Pa+sat&amp;hnear=&amp;ll=1.342956,103.818054&amp;spn=1.142245,2.113495&amp;t=h&amp;z=10&amp;iwloc=B)* [Old Airport Road Hawker Center](http://maps.google.com.sg/maps/place?hl=en&amp;sugexp=llsfp&amp;pq=old+airport+road+food+center&amp;xhr=t&amp;cp=16&amp;prmdo=1&amp;bs=1&amp;um=1&amp;ie=UTF-8&amp;q=old+airport+road&amp;fb=1&amp;gl=sg&amp;hq=old+airport+road&amp;hnear=Singapore&amp;cid=10924806847418019386)**Recreation*** Universal Studios* Sentosa* Singapore Zoological Gardens* Jurong Bird Park* Wild Wild Wet* Singapore Botanica Gardens* Changi Airport Nature Trail (Only if you're stuck at the airport or if you have free time, travelling there takes a toll on the cab fare)* [Heritage and Cultural Areas in Singapore](http://www.journeys.com.sg/singaporewalks/index.asp)* [Henderson Wave Walk](http://deadpoetscave.com/2008/05/southern-ridges-visual-guide-west-coast-park-to-harbourfront/)* [National Library](http://maps.google.com.sg/maps?f=q&amp;source=s_q&amp;hl=en&amp;geocode=&amp;q=National+Library&amp;aq=0&amp;sll=1.306423,103.884659&amp;sspn=0.015681,0.015471&amp;gl=sg&amp;ie=UTF8&amp;hq=National+Library&amp;hnear=&amp;t=h&amp;z=14)* [Sentosa Boardwalk](http://www.sentosa.com.sg/en/getting-around/sentosa-boardwalk/)* [Memories at Old Ford Factory](http://www.s1942.org.sg/s1942/moff/)* [Bukit Chandu](http://www.s1942.org.sg/s1942/bukit_chandu/homepage.htm)* [Chinatown Heritage Center](http://www.chinatownheritagecentre.sg/)**Clubs*** [The Cannery](http://maps.google.com.sg/maps?f=q&amp;source=s_q&amp;hl=en&amp;geocode=&amp;q=The+Cannery&amp;aq=&amp;sll=1.289798,103.846207&amp;sspn=0.029518,0.041971&amp;ie=UTF8&amp;hq=The+Cannery&amp;hnear=&amp;ll=1.290312,103.846207&amp;spn=0.028446,0.041971&amp;z=15&amp;iwloc=A)* [Zouk](http://maps.google.com.sg/maps?f=q&amp;source=s_q&amp;hl=en&amp;geocode=&amp;q=Zouk&amp;aq=&amp;sll=1.302583,103.853116&amp;sspn=0.069247,0.132093&amp;ie=UTF8&amp;hq=Zouk&amp;hnear=&amp;ll=1.30151,103.853073&amp;spn=0.071393,0.132093&amp;t=h&amp;z=14&amp;iwloc=A)* [Attica](http://maps.google.com.sg/maps?f=q&amp;source=s_q&amp;hl=en&amp;geocode=&amp;q=Attica&amp;aq=&amp;sll=1.30151,103.853073&amp;sspn=0.071393,0.132093&amp;ie=UTF8&amp;hq=Attica&amp;hnear=&amp;ll=1.299365,103.853073&amp;spn=0.142786,0.264187&amp;t=h&amp;z=13&amp;iwloc=A)* [Butter Factory](http://maps.google.com.sg/maps?f=q&amp;source=s_q&amp;hl=en&amp;geocode=&amp;q=Butter+Factory&amp;aq=&amp;sll=1.299365,103.853073&amp;sspn=0.142786,0.264187&amp;ie=UTF8&amp;hq=Butter+Factory&amp;hnear=&amp;t=h&amp;z=12&amp;iwloc=B)* [St James Powerhouse](http://maps.google.com.sg/maps?f=q&amp;source=s_q&amp;hl=en&amp;geocode=&amp;q=Powerhouse&amp;aq=&amp;sll=1.299365,103.853073&amp;sspn=0.27699,0.528374&amp;ie=UTF8&amp;hq=Powerhouse&amp;hnear=&amp;ll=1.295246,103.853073&amp;spn=0.285571,0.528374&amp;t=h&amp;z=12&amp;iwloc=A)**Shopping*** [Bugis Village](http://maps.google.com.sg/maps?f=q&amp;source=s_q&amp;hl=en&amp;geocode=&amp;q=Bugis+Shopping&amp;sll=1.359,103.818&amp;sspn=0.571126,1.056747&amp;ie=UTF8&amp;hq=Bugis+Shopping&amp;hnear=&amp;t=h&amp;z=11&amp;iwloc=B)* [Sim Lim Square](http://maps.google.com.sg/maps?f=q&amp;source=s_q&amp;hl=en&amp;geocode=&amp;q=Sim+Lim+Square&amp;aq=&amp;sll=1.342956,103.818054&amp;sspn=1.142245,2.113495&amp;ie=UTF8&amp;hq=sim+lim+square&amp;hnear=Sim+Lim+Square,+1+Rochor+Canal+Rd,+Singapore,+SG+188504&amp;t=h&amp;z=15) **AVOID LEVELS 1-3 CONSULT /r/singapore if you have to, we'll be glad to help*** [Funan DigitalLIFE Mall](http://maps.google.com.sg/maps?f=q&amp;source=s_q&amp;hl=en&amp;geocode=&amp;q=Funan&amp;aq=&amp;sll=1.30309,103.8531&amp;sspn=0.034624,0.066047&amp;ie=UTF8&amp;hq=Funan&amp;hnear=&amp;ll=1.302583,103.853116&amp;spn=0.035696,0.066047&amp;t=h&amp;z=15&amp;iwloc=B)* [Tekka Market](http://maps.google.com.sg/maps?f=q&amp;source=s_q&amp;hl=en&amp;geocode=&amp;q=Tekka+Market&amp;aq=&amp;sll=1.302111,103.866634&amp;sspn=0.060581,0.061884&amp;gl=sg&amp;ie=UTF8&amp;hq=Tekka+Market&amp;hnear=&amp;ll=1.300996,103.863287&amp;spn=0.062726,0.061884&amp;t=h&amp;z=14&amp;iwloc=B)* [Chinatown](http://maps.google.com.sg/maps?f=q&amp;source=s_q&amp;hl=en&amp;geocode=&amp;q=Chinatown&amp;aq=&amp;sll=1.300996,103.863287&amp;sspn=0.062726,0.061884&amp;gl=sg&amp;ie=UTF8&amp;hq=&amp;hnear=Chinatown+MRT+Station&amp;ll=1.284713,103.844007&amp;spn=0.007841,0.007735&amp;t=h&amp;z=17)",What you should do when you're in Singapore.,12,,http://www.reddit.com/r/singapore/comments/gc9oh/what_you_should_do_when_youre_in_singapore/,,"|Don't forget Four Floors of Whores and the expat bars on Emerald Hill.|night safari? timbre? zouk? butter factory? st james?lol i just listed places i've never been to|Shopping section is missing. Bugis for cheap stuff.|lol my friend worked for Wild Wild Wet in high school as an angmoh pirate. He was 6'2, pale, and rail thin, so his appearance was already scary enough for Singaporean kids.Let's not just copy the Singapore Tourism Board.Clubs is incomplete. Put Zouk, Attica, and Butter up there. St. James' is a creepshow since the age limit is 18 for girls and 23 for guys.Universal Studios is not a good value. It's expensive to get in, and since there's no space, all the rides are like half the normal size. The Battlestar Galactica ride still isn't operational because it hasn't passed safety tests yet, so the biggest ride in the park isn't even working. The Shrek ride literally lasts less than a minute. I've been on longer rides at the Orange County Fair.Changi Nature Trail is seriously too ulu ulu for an angmoh to visit. If you're stuck at the airport, that's not the worst thing in the world; there's tons of stuff to do at the airport plus you can take the MRT to Orchard if the layover is that long. I'd go with the Treetop Walk instead, since it's off Upper Thomson. |Someone needs to do link some ""research"" from Sammyboy forums.|[Walking tours of heritage and cultural areas in Singapore.](http://www.journeys.com.sg/singaporewalks/index.asp)|i feel victor's kitchen is severely overpriced and taste not that great altogether|NLB for the view! also, Chinatown and Little India (above Tekka market) have fantastic shopping. Tekka Market also good for spices to bring home and show off.|Lau Pa Sat is actually quite awful. |all the recommended food are terrible tourist trapstry old airport road food centre|Sentosa boardwalk? Inclusive of daily fireworks and crane show.. Awesome view in the night.|Can I contribute some places to go for history buffs?  [Memories at Old Ford Factory](http://www.s1942.org.sg/s1942/moff/)  Where the British surrendered to the Japanese. Lots of photos and written accounts.    [Reflections at Bukit Chandu](http://www.s1942.org.sg/s1942/bukit_chandu/homepage.htm)  One of our fiercest battles was fought here before Singapore fell to the Japanese. There are interactive galleries and artifact displays too.    [Chinatown Heritage Centre](http://www.chinatownheritagecentre.sg)  Located just outside of Chinatown MRT station, the centre is a preserved shophouse that has been 'restored' to let visitors see how the lifestyle was like from the 1900's to 1950's.    I do recommend Singaporeans to visit these places too, especially if you're one of those who complain that there's nothing to do :)|Gotta put Newton into the food. Sure it's overpriced and low in quality, but it's still a good experience. As for clubs, Filter is also recommended.|Oh and since redditors are awesome: haw par villa is a must"
,1301306019,1,,t3_gd19a,,1,0,,Does anyone know a good place in Singapore to get photos printed on canvas?,1,,http://www.reddit.com/r/singapore/comments/gd19a/does_anyone_know_a_good_place_in_singapore_to_get/,,|may do well to ask at clubsnaphttp://www.clubsnap.com/
,1301294386,1,,t3_gcyrh,,3,2,,Top 10 reasons why Singapore is the BEST place to work in for foreign migrant workers,3,,http://www.temasekreview.com/2011/03/09/top-10-reasons-why-singapore-is-the-best-place-to-work-in-for-foreign-migrant-workers-2/,,"|Tongue in Cheek post, which i laughed at, yet feel a sense of disappointment... opinions?|From the article, what I can see is that the author doesn't know much about the home countries of the foreign workers... A lot of assumptions and generalisation. Typical Singaporean who doesn't get out much and feels shocked to see clean toilets in Malaysia (if he ever steps out).  As for the other points he made about new immigrants not integrating... very true and very sad.    But I don't think it's their fault for taking advantage of us... We let this happen.    (You know what to do this coming election)"
*badum-tish*,1301398707,4,,t3_gdv0p,,14,6,"""... indeed, the contrast altogether is so great, that I have often felt surprised that a British resident of Batavia who visits Singapore on commercial business, or for the recovery of his health, can ever prevail upon himself to return to that pestilential and misgoverned city."" - George Windsor Earl, midshipman, writing on Singapore in 1832-1834What a change, r/singapore. Who would've ever thought?","""At Singapore there exists no political bar to social intercours; no dread that private conversations may be reported to a jealous and unforgiving government; ...""",10,,http://www.reddit.com/r/singapore/comments/gdv0p/at_singapore_there_exists_no_political_bar_to/,,"|I don't understand what you are trying to tell us. So Singapore in the 1830's had better conditions than Batavia (Colonial Jakarta)? What's the subject matter to contrast here? If you say general living conditions in Indo versus general living conditions in SG, than I'd say not much has changed.|I have no clue what you are trying to imply.|I think they are saying that nothing has changed. The Govt back then is still the way the govt acts today.|I think you accidentally the point.|Unless, of course, you happened to do anything to threaten the profits of the East India Company, in which case you would be ""disappeared"" right quick.  The old time Brits didn't fuck around."
,1301379219,2,,t3_gdqse,,10,5,,What does Reddit think of PAP's youngest candidate so far?,7,,http://www.mrbrown.com/blog/2011/03/meet-paps-youngest-candidate-so-far.html,,|I'm afraid.|just another pretty face?|Ugh|she's an ah lian. the act cutesy type that makes me feel sick to be a singaporean woman. |This is what we call the Sarah Palin vote.
,1301374233,2,,t3_gdpab,,7,16,,DAE feel like the newspapers are more like a newsletter for the whatisname party?,18,,http://www.reddit.com/r/singapore/comments/gdpab/dae_feel_like_the_newspapers_are_more_like_a/,,"|[deleted]|What could possibly have given you that impression??Seriously though, SPH is such a government mouthpiece it's shameful.|It doesn't help that the alternatives are either unreliable or are self censored out of fear. It's embarrassing. |Well they all have their own agendas to serve. Take whatever that we are given (news on print, news from TV, radio, etc) with a pinch of salt and never stop asking questions and seeking truths.|need a john stewart|I opened today's papers and I cried out, 'My kingdom for an independent newspaper!' Too bad SureIlldrawthat doesn't visit this sub reddit much."
wannabewriter,1301372245,1,,t3_gdom5,,11,10,,"Tin Pei Ling, Youngest PAP candidate and YouTube sensation :D",11,,http://www.youtube.com/watch?v=sAaZBVo6jgI,,"|I don't know what to say! *bounce bounce bounce*|Actually the video doesn't really show much, other than she preparing for an event. She's only 27 after all. But what really concerns me is this:&gt;The NUS psychology graduate is married to civil servant Ng How Yue, 40, who is the principal private secretary to Prime Minister Lee Hsien Loong.ಠ_ಠ|Needs to go to toast masters more.Frankly, if you're the youngest PAP candidate, I would expect you to be damn zai. Smooth like a muthafucking snake. But instead I get some act cute bimbo.Maybe they are trying to show she is a normal person, just like everyone else, but frankly, the average singaporean is a dumb piece of shit(myself included), and I don't want a dumb piece of shit to be in politics. So this candidate has done nothing but reinforce my opinion that politics in singapore is a joke.|gives new meaning to ""backdoor entry""|Oh look the PAP is so young and hip. Come on youngsters vote PAP.Bwahahahahahahahahaahahahaha.|I agree with 92037 - forgive me for amateur political commentary but it seems like a deliberate move on the part of the PAP to attempt to capture the younger sectors of the population by presenting an allegedly 'fresh young face'. In this sense she reminds me of Palin - and we all know how well that went down for Biden. I do hope that the recognition and savvyness of this generation translate into actual political results. Or in the first place I hope the petition for her to run in an SMC gets through - a man can dream, can't he? It's here fyi: http://www.ipetitions.com/petition/tinpeiling/And again, having a husband like hers couldn't hurt either (:"
,1301363684,1,,t3_gdlfl,,0,0,,Care for Soldiers ,1,,http://i.imgur.com/bf2PA.jpg,,
,1301506272,1,,t3_getvw,,4,4,How come the Straits Times gets away with stuff like this?tl;dr: ST just edited a forum letter to read the opposite from what it means.http://visaisahero.wordpress.com/2011/03/22/more-straits-times-wizardry/,It's shit like this ST,5,,http://www.reddit.com/r/singapore/comments/getvw/its_shit_like_this_st/,,"|no link to anything? :\ Your TL;DR is longer than the message.|sorry had an error 502. Edited to post the link|If you write in to the forum, you are playing their game. You can't win. So don't write in. Write your opinion somewhere else. Like here on Reddit. The forum is already nothing more than a public complaints mailbox. Bad service here, bad experience there, oh I want it my way or I will write to the newspapers. And the rest are just brown nosing letters. Deny them content and they will become irrelevant. "
Everything Needs More Tits!,1301476085,5,,t3_gelnq,,2,0,"I am jesus, and all of you are lepers",i just wanted to say,2,,http://www.reddit.com/r/singapore/comments/gelnq/i_just_wanted_to_say/,,|Good afternoon minister!
knnccbwtfbbq,1301472460,2,,t3_gekxp,,1,5,,"x-post from f7u12, singapore bus confuzzels the crap out of me",7,,http://www.reddit.com/r/fffffffuuuuuuuuuuuu/comments/ged3j/awkward_hand_traditions_fixed/,,"|I dont know why my mind is hurting so much.Looking at the image,It seems to be a typical SBS bus,We got that retarded 1 adult 1 child seat, with some lady in blue sitting there. Check.We got the big awkward waste of space, which is due to the bus wheel. Check.We got the few seats, check.we got the door. Wait, isn't the door supposed to be on the other side?*scratches head**edit*: I finally realised it. He flipped the image horizontally. Mind fuck successfully avoided."
Big Brother is Watching.,1301466203,1,,t3_gejby,,0,6,,Politics are a little like this.,7,,http://www.youtube.com/watch?v=_JmA2ClUvUY,,
,1301456287,4,,t3_geg2o,,6,2,,Tuna Sing,6,,http://i.imgur.com/LnT3H.jpg,,"|To our dear expat Redditors, feel free to repeat the title to your local colleagues. Say it faster."
,1301580207,4,,t3_gfiyu,,0,0,,Singaporean Soldiers use maids to carry thier Army packs,3,,http://imgur.com/qKq2R,,
,1301557308,2,,t3_gfdlz,,0,0,,Dubai the dream city ,1,,http://www.celebrity-blogs.info/2011/03/dubai.html,,
,1301540341,3,,t3_gf84b,,6,10,"&gt;1. You stated we wrongly replaced the statistic you cited with another from Ms Rachel Chang’s article on March 8 (“School system still the ‘best way to move up’).&gt;Your original letter    “It is indeed heartwarming to learn that 90% of children from one-to-three-room flats do not make it to university.”&gt;Reasons we edited it: Factual error, sense.&gt;There were two problems with your sentence. First, it was contradictory and didn’t make sense.Your original sentence cannot mean what it says unless you were elated over the fact that nine in 10 children from less well-off homes failed to qualify for university. So we edited it for sense, i.e., underscoring a positive feeling (heartwarming) with a positive fact; rather than the self-penned irony of a positive feeling (heartwarming) backed by a negative fact (90% failure rate to university admission by less well off children). That was why we replaced the original statistic with the only one in Ms Chang’s March 8 report that matched your elation, that is, that 50 percent of less well off children found tertiary success.",ST forum trolls troll.,13,,http://www.reddit.com/r/singapore/comments/gf84b/st_forum_trolls_troll/,,"|tl dr; Reader writes in with sarcastic letter 'praising' education system. ST edits it to real praise and replies to his complaints that they are merely correcting his statistics to fit his positive feeling.|Sauce: http://visaisahero.wordpress.com/2011/03/25/sts-justification-of-its-liberal-editing-of-forum-opinions/|bro, i think someone is creating accounts downvoting all links criticizing ST. My submission a couple of hours from yours with the same article keeps the same downvote count."
Big Brother is Watching.,1301663881,0,,t3_ggctr,,0,9,,GE Poem by Nikki Wang,9,,http://nikiwang.tumblr.com/post/4254134896/ge-poem,,
your mother horse,1301639429,2,,t3_gg6b7,,7,24,,someone is going to lose his/her job on april fools' day...,26,,http://i.imgur.com/PuzLm.jpg,,|&amp;#3232;\_&amp;#3232;|...Of all the tweets that he could have posted accidentally...  *cringe*|Probably fake.|Maybe someone finally snapped after being cursed by one reader too many...
,1301844828,1,,t3_gho5f,,1,0,Just curious. Have a brilliant idea for a facebook game. Thought 'll look here for a start.,Any game developers over here?,1,,http://www.reddit.com/r/singapore/comments/gho5f/any_game_developers_over_here/,,|What kind of game are you looking at?
,1301841062,2,,t3_ghn9v,,8,2,,"Tin Pei Ling Speaks on Education Costs = ""very low"" she says",4,,http://www.youtube.com/watch?v=EzXYqaL41iI,,"|Your young ones goes to university? This video is sensationalist.|I think the PAP shot themselves in the foot with her.  Of all the talented young people in S'pore and yet she is seeking office with a hoard of media following her to record every nose pick.  I believe the PAP is not so strong this election cycle, certainly this cannot help."
,1301814067,0,,t3_ghj00,,0,10,,Particularly relevant for the upcoming election - Alfian Sa'at's 'Trawlers',10,,http://i.imgur.com/yTLrZ.jpg,,
,1301956632,0,,t3_gio61,,0,1,"Yeah... not anything special, but I just want to know the story between drugs and Singapore? Laws? Availability? etc.....",Drugs in Singapore? ,1,,http://www.reddit.com/r/singapore/comments/gio61/drugs_in_singapore/,,
