author_flair_text,created_utc,downs,likes,name,no_follow,num_comments,score,selftext,title,ups,upvote_ratio,url,view_count,comments
,1298900137,1,,t3_fuacu,,33,4,"I'm going to Singapore for IFFS which is an international furniture show. I think I'll be spending most of my time at the show, but I'll have the nights off and would like to go out exploring/drinking/taking it all in. Give me some pointers!!",Going to be in Singapore for a week and a half for business. What should I know/do?,5,,http://www.reddit.com/r/singapore/comments/fuacu/going_to_be_in_singapore_for_a_week_and_a_half/,,"|Go for a walk along the Singapore river by Clarke Quay and Boat Quay. Lots to do there! |If you only have nights off, then the only exploring you could be doing is the Night Safari. I'm a bit sheepish to say I haven't been there though. Hah. Otherwise, shopping malls are open till about 10-ish on weekdays, and 11-ish on weekends. We have a casino (big hoohah over that when they were proposing to build one), so there's that if gambling's your thing.There are many places to drink in Singapore, but since you'll be at the Expo, I'm not too familiar with the watering holes there (if any). If you're willing to travel a bit further, you can visit Clarke Quay where there are many pubs. It's a small island, but to us locals places on the other side of the island seem relatively far - don't scoff.Edit: Oh, and welcome fellow web developer/designer.|What interests you? There's lots to do from high-end to budget, shopping to exploring. If you haven't spent much time in Asia, then take the opportunity to sample the different cultures Singapore has to offer. If you're an epicurean, there's amazing food here too.|Eat. Eat at hawker centres. Eat a lot of local food. More specifically, go to the Maxwell Road hawker centre near Chinatown and order Hainanese chicken rice from Tian Tian. If you go, go early, because they close whenever they run out of chicken, which can be early as 3 PM.If you like clubbing, go to Zouk or maybe Attica or Butter. Avoid Zirca like the plague.|* Walk. I read that you'll be staying at Ibis at Bencoolen, it's a nice area to walk at night. Just go, walk and explore the area! * Eat local. As mentioned by achingchangchong, I would encourage you too venture into the hawker centres/local coffee-shops as much as possible. It's cheap and awesome! * No tipping is required (but welcomed nevertheless), service is being taxed here.* Visit Little India at night or Sunday afternoon. There's a 24-hr store, Mustafa, that sells anything and everything. This area is very different from the rest of Singapore, as it is like enclave for foreign Indian workers. Go there if you're in for something different |[deleted]|i stay 5 mins away from hotel ibis. feel free to ask me anything|Go to Bali for the weekend or anywhere else.|Enter the keyword Chomp Chomp in your gothere.sg app for good food! Don't go to Newton Circus Hawker center though, that place is a letdown.|may not be that near bencoolen, but the chicken murtabak at zam zam is excellentSingapore Zam Zam697 N Bridge Rd, Singapore 198675but in my opinion Thompson Prata House is much better than Zam Zam, only issue is that it is really far from central areas(i drive 30 minutes to eat there anyway!)The Roti Prata House246M Upper Thomson Road|[deleted]|let's all be honest hereorchard towers. look it up on wikipedia!|Don't try to bring in drugs and don't try to get any drugs when you're visiting.They're very, **very** fucking strict.Mandatory death penalty strict."
,1298982393,6,,t3_fv07m,,22,20,,Why there are no artists in Singapore,26,,http://i.imgur.com/j9KQS.png,,"|To be fair, at least from my vantage point as someone involved with the investment, the government is doing all that it can to cultivate artists and the intersection of art and commerce -- professions like industrial designers and architects.  Three new art schools and a massive investment in design studios for instance.The obvious advantage is that such industries can flourish in a space constrained country such as Singapore.  They are some of the ideal, high paying professions for such a country.  We can't do heavy industry as it takes too much space and we can't all be bankers.|SINGAPORE! ლ(¯ロ¯ლ) Y U NO ARTISTS!|Funny thing. My friend and i were discussing about quitting school and starting a band after he watched a movie based on John Lennon's life - Nowhere Boy. The whole idea seem so retarded that the discussion didn't last long and we proceeded to listen to our lecturer drone about viscous flow. I think this short situation speaks volume of the mentality of parents and their expectations of their kids. Study to get good grades, get into better school. Repeat.|There are artists in Singapore, but the really good ones are ""discovered"" at a very young age and shipped off to other countries because there are better opportunities there as well as support.|[The Straits Times Online Article](http://www.straitstimes.com/BreakingNews/Singapore/Story/STIStory_640164.html) although the discussion here is on a different topic, just thought I'd throw it in.|There is a dance school close to where I live. Sometimes, I observe the dancers there practicing their moves. I see a lot of hard work and dedication in their efforts. What I don't see is conviction. Or originality. Their dance moves are perfect technically but they look false and pretentious and mechanical. As an outsider, I feel that Singapore is refusing to get inspired from within. Art is often born inside and gets inspiration from one's cultural heritage. Singaporean artists, I think, are struggling with an identity crisis that's stopping them from drawing inspiration from their own cultural roots. Instead, they are trying too hard to ape the west and failing miserably. Some of the best artists, poets, writers, musicians have lived in abject conditions or have gone through phases of extreme personal crisis. Yet they emerged out even better as artists from these experiences. |I'm coming in a a bit late but let me just chip in to the discussion.I'm sure most of you guys are familiar with [Marslow's Hierarchy of Needs](http://en.wikipedia.org/wiki/Maslow%27s_hierarchy_of_needs). Society goes through different stages (yes yes Marxism blah blah blah): from the developing economy with a citizenry of primarily lower class inhabitants seeking to fulfill basic needs of subsistence up to the developed, rich states with a strong welfare system or where the majority of citizens are well-off enough to contemplate the ostentatious rather than the essentials.Singapore has arguably gone through that cycle in the span of slightly more than a generation; it will be a tall order for the generation who grew up in the 60s and 70s to expect their children to abandon their beliefs of self-enrichment through economic wealth for self-actualisation. I know I am hopelessly simplifying things here but I hope you get my point that it is difficult to change society's notion regarding the importance of art in the span of one or two generations.The current generation who grew up in the late 90s are increasingly seeking self-actualisation as their basic needs are assured and taken care of. Hence the demand for more art schools like SOTA or degree courses in art like those at NTU's ADM. This current generation will need time to mature artistically, and in turn expose society to notions of self-actualisation, beyond just fulfilling material needs, wants and desires. Artists are rare in the older generation. Pioneers like Liu Kang or Ng Eng Teng belong to the pre-independence generation, and many of them come from well-to-do families who can afford their overseas art education. Note the dearth of prominent artists in their 50s and 60s, basically those who grew up during the independence period and during the time when Singapore was struggling to develop its economy and feed its citizens. And in recent times there is the young crop of artists in their 20s and 30s, brought up in the 80s and 90s when Singapore's main populace entered the middle class. There is a strong co-relation between the growth of the culture scene and the economic health of the nation.|talent is inborn and not acquired from force feeding education down our throatsthe latter is how we learn in singapore|Unfortunately, a career in art remains a relatively huge risk and a poor career choice overall, and is thus not encouraged unless someone shows fantastic talent from young or something. With the high costs of living and the lack of a social security net, it is simply not feaaible to take such a risk. |Also a bit late to the conversation, but here're my two cents anyway. It's a complex issue, but one well worth discussing.One of the biggest problems about art in Singapore is the fact that so many things are censored - the eternal question of freedom of speech and lack thereof here. Someone (I can't remember now who and may well be mangling the quote...) once said, ""Art is all the things you don't talk about at the dinner table with polite company: sex, politics and religion."" Subjects, which, as those who have lived here long enough to know, are taboo. Look at the Straits Times, mouthpiece of the nation. &amp;#3232;\_&amp;#3232;It's not just about [getting inspired from within as selfish_jean said](http://www.reddit.com/r/singapore/comments/fv07m/why_there_are_no_artists_in_singapore/c1iwsg0) or that it's [""an emergent sociological phenomenon that is highly dependent on culture""](http://www.reddit.com/r/singapore/comments/fv07m/why_there_are_no_artists_in_singapore/c1itlry), but definitely more of what [tuxedodiplomat said, i.e., ""cannot be dictated top-down""](http://www.reddit.com/r/singapore/comments/fv07m/why_there_are_no_artists_in_singapore/c1itprq), although [culture and identity](http://www.reddit.com/r/singapore/comments/fv07m/why_there_are_no_artists_in_singapore/c1iy3et) are an intricate part of the equation.What we have here, on the one hand, is that artists' hands are quite tied by what they can or cannot discuss. This, in my opinion, takes away a lot of depth in Singaporean art, which becomes, as a result, all gloss and no substance. Eye-candy, easily consumed. Is this a good thing? Most would say not.Or maybe it is, because it disseminates art to a wider audience, and what is art if not something people — anyone! — can identify with? Maybe this is something Singaporean culture has to go through, maybe this is what helps to define its identity. Before good, thought-provoking art can be made, we need to know what the rules are, then and only then can we demolish them. On the other hand, I for one can see how this might give rise to an undercurrent that attempts to find creative ways to circumvent the restrictions, and if so, all the better. I wouldn't know for sure, but I suspect it might be so. I know a lot of people who are dissatisfied with the status quo, and this is especially true for the generations that grew up from the 80s onwards. And in this case, I would say hooray for the government's attempts at pumping money into the art scene, because they may think they know what they're trying to control, but if humanity proves me right, then there will be ways and means to develop and create something that was never dreamt of before.Oh my, how optimistic I sound. But really, I just wanted to say that there *are* artists in Singapore. They're hidden in the nooks and crannies of dusty, dingy shophouses and in the outskirts and in the ""heartlands"", a lot of the times arm in arm with foreigners (lament that as you will or no), but you can find them if you look hard enough."
,1298978020,1,,t3_fuzdv,,22,6,"Hi, I am new here! :-)I am planning on getting an internship in Singapore (seems like having the best concentration of jobs/internships in my work-field) and would like to ask a few questions:* What are the living expenses? I am mostly interested in the rent, public transportation and food related costs* Is it as safe as it appears to be?* Are there any of you working in the web industry (design / development)? If yes, what would be the salary for an entry level junior designer / intern? I don't have high expectations but all the internships I have listed and plan to apply to in the recent future ask for the ""expected salary"" and I would like to ask for a salary that would cover my living expenses or a little bit lower.Thanks in advance for your answers!",Planning on getting an internship in Singapore and have a few questions,7,,http://www.reddit.com/r/singapore/comments/fuzdv/planning_on_getting_an_internship_in_singapore/,,"|* Rent is *very* high.  It would depend if you wanted your own place, or if you rented a room.  Rooms can be had for around $500 sing if you share a place.   $2,500 for a 3 bedroom HDB (public housing) or $5k for a condo.  It varies considerably by area and size of course.Food can be quite reasonable.  It isn't uncommon that I spend less then $5 eating out.  Honestly, it is cheaper to eat out then in usually.Public transport varies quite a bit depending if you are discussing taxi, bus or train.  A few sing to go from A-&gt;B on the train or bus.  $10 for a taxi at a non peak time.*  Yeah, it's really that safe.  Currently this year #2 safest with regard to intentional homicide after Iceland.  I only bring that up because I just looked at the statistics.  13x more murders per capita in the US incidentally.* I have some friends that work in the web industry.  Salary varies *considerably* depending on experience.Local salaries can be very different then expat salaries.  The good news is that the salary curve is fairly flat in that profession, so most people here make a liveable wage.   I am assuming that intern positions pay local wages.  |[deleted]|$1-2 per train ride, &lt;$2 per bus ride, cabs will vary depending on time of day but maybe $15+ if you're 20 minutes from the city during peak hoursRent for a small condo is at least 2.5k/month and if you want anything near the city you're looking at much more. I know someone who was renting one bedroom in a public housing apartment for 1.1k/month.Food is cheap, you can get a good meal for as low as $3 if you know where to go but average is about $4-5 at a food court.Yes SG is about as safe as you've heard. As long as you don't eyeball any rowdy-looking teenagers or their girlfriends you should be able to roam wherever you like, at any time of day.Sorry I can't advise on the web industry, not familiar with it!|IT industry? ... non native indians with master degrees are asking for $1.5-2k SGD a monthunless you have a mindboggling and impressive resume don't even bother |* Rent varies by location: **SGD 500** can get you a room in a public housing flat about 15-20 minutes away from the city centre. **SGD 850** will get you a room closer to the city or in a condominium with facilities. Check [Craigslist](http://singapore.craigslist.com.sg/roo/); it has decent postings every so often but gets flooded by spam once in a while. Always ask for pictures.* Public transportation isn't that expensive. Budget about **SGD100** a month for buses and you should be good to go. More if you take cabs or stay further from work/fun.* Food averages to about **SGD 10** a day if you eat at local eateries. **SGD 15-20** if you need to snack and imbibe on fast food.* Yes it is very safe. But like everywhere on earth, a bit of sense goes a long way.* Like what croissanwich said, Singapore can get saturated with foreigners. But there is always hope. Singapore does like foreign talent after all. **SGD 2000** should be more than enough to survive and still hit the pub every weekend. That said, Singapore isn't known for its high salaries. If home is paying better, why move?TL;DR apply and get the job first; they'll never pay less than what you need to survive on. You can always just leave the expected salary portion blank.|I'm in the industry &amp; may be able to help you out. PM me your details if you're keen.|I'm in the web design/dev industry, and junior level developers earn about S$1700. However it depends on your qualifications. You gotta have a diploma at least.  The good thing is you can get 100% of the salary every month as opposed to the locals and permanent residents. You will be able to survive decently since the food and transport are affordable. It's the rent that will kill you (as you have probably learned by now). Good luck! :)|Hi,I work for a start-up company (or used to work) that was acquired by a MNC, and companies like mine used to hire interns a lot of time.1. Most of the guys here are correct in terms of expenses - 600SGD for a room in a HDB apartment, 500 SGD/month for food, transport is cheap &lt;100SGD2. Yes it's safe 3. If you're an intern, you are not going to earn more than SGD 1000, this is because conceptually, interns in Singapore are non-graduates who work 3-4 months, and most corporations take them in as a favor to the universities. The average monthly renumeration we gave was between 6 to 8 hundred SGD a month for the start-up I worked for, but frankly if I was an intern I would take that rather than an offer an large company might make. It's much more rewarding doing something useful in a start-up and mixing around with people your age than interning as a data entry clerk. How long do you intend to stay in Singapore for? Don't want to be a wet blanket, but if its a temporary stay, and you want to use your web design skills, you have to intern in a startup company and not expect more than 800 bucks a month. Alternatively, if you have work experience or startup experience, you can act as a freelance developer! The start-up community in Singapore is pretty tightly knit, with people knowing each other. The Local University NUS itself is a base for many of the startups. Echelon 2011 (most countries call theirs ""unconference"") is in mid June and you can meet a lot of start ups and opportunities."
,1298942349,1,,t3_fupo4,,3,3,[Does this mean need to be wary of our torrents?](http://www.channelnewsasia.com/stories/singaporelocalnews/view/1113417/1/.html),IDA issues Code of Practice to ensure secure internet infrastructure,4,,http://www.reddit.com/r/singapore/comments/fupo4/ida_issues_code_of_practice_to_ensure_secure/,,|I am more worried about the shit we put on facebook.|time to invest in private vpn
Big Brother is Watching.,1299063594,6,,t3_fvpxm,,1,4,,I'm sure some of us had experienced this before. It happened to me today. [ragecomic],10,,http://i.imgur.com/ScGPj.png,,|oh hell yes. I feel like Sun Tzu planning my move towards the exit. Same goes for MRT!
your mother horse,1299060813,0,,t3_fvpfw,,4,10,,hey guys i think we need some real singaporeans here to dispute this ancient article...,10,,http://www.reddit.com/r/WTF/comments/ftoli/there_is_a_5000_reward_for_mothers_who_agree_to/,,|Honestly it seems like plenty of Singaporeans have already chimed in.|What's there to dispute? The article was spot-on.
,1299165930,2,,t3_fwl0r,,0,2,,"Pls revert, thks.",4,,http://pls-revert.tumblr.com/,,
