author_flair_text,created_utc,downs,likes,name,no_follow,num_comments,score,selftext,title,ups,upvote_ratio,url,view_count,comments
Emeritus Minister Mentor,1211622535,,,,1,1,0,,Come on Singaporeans! post something here allready!,,,https://www.reddit.com/r/singapore/comments/6kmch/come_on_singaporeans_post_something_here_allready/,,
Emeritus Senior Minister,1213864103,,,,0,0,3,,Singapore to be RickRolled! (Sunday line-up) Apparently nobody realized it's supposed to be a joke.,,,http://www.sistic.com.sg/portal/dt?dt.isPortletRequest=true&amp;dt.action=process&amp;dt.provider=PortletWindowProcessChannel&amp;dt.windowProvider.targetPortletChannel=JSPTabContainer/sEventsCalendar/Event&amp;dt.containerName=JSPTabContainer/sEventsCalendar&amp;dt.windowProvider.currentChannelMode=VIEW&amp;dt.window.portletAction=RENDER&amp;contentCode=singfest0808,,
Emeritus Senior Minister,1214114963,,,,0,1,4,,"""Singaporeans are lucky to have a newspaper, The Straits Times, that frequently remind us that the opposition is full of flaws, weaknesses, and are devoid of good ideas.""",,,http://singaporemind.blogspot.com/2008/06/other-opposition-party-is-just-as.html,,
Emeritus Senior Minister,1215805723,,,,0,0,2,,The International Bar Association and its Report on Singapore,,,http://mrwangsaysso.blogspot.com/2008/07/international-bar-association-and-its.html,,
,1222781176,,,,1,0,1,[deleted],RIP JB Jeratnam. Possibly Singapore's greatest citizen.,,,http://en.wikipedia.org/wiki/Joshua_Benjamin_Jeyaretnam,,
Emeritus Senior Minister,1222782080,,,,0,1,2,,RIP JB Jeyaretnam. Possibly Singapore's greatest citizen.,,,http://en.wikipedia.org/wiki/Joshua_Benjamin_Jeyaretnam#Background_and_political_career,,
Emeritus Senior Minister,1223162276,,,,0,0,2,,HDB and Power Companies: What's Happening?,,,http://theonlinecitizen.com/2008/10/hdb-and-power-companies-whats-happening/,,
Emeritus Senior Minister,1224654972,,,,1,0,1,,"Good article on the Singapore economy: ""Review strategy, take crisis as opportunity """,,,"http://app.mfa.gov.sg/pr/read_content.asp?View,11258,",,
,1228974591,,,,1,0,1,[deleted],"Singapore shopping and dining guide, discount coupons, street maps and more!!",,,http://www.dc2go.net,,
,1236417019,,,,0,0,2,[deleted],"Where can I buy granola or unmixed grains in Singapore, East side, that is cheaper than in NTUC or Cold Storage?",,,https://www.reddit.com/r/singapore/comments/82so1/where_can_i_buy_granola_or_unmixed_grains_in/,,
,1246436322,,,,1,1,0,,Cannla Auctions have put their money where their mouth is and are selling items for $1. Get in there Singaporeans!,,,http://www.cannla.com/Member/Listings.aspx?MemberId=2120,,
,1246437083,,,,0,4,6,,Is Singapore really so boring people feel the need to comment on where people sit on the bus? Get a life!,,,http://singaporeseen.stomp.com.sg/singaporeseen/viewContent.jsp?id=76773,,
,1247019951,,,,1,1,0,,PM LEE HSIENG LOONG STATUE,,,http://www.cannla.com/Auctions/Antiques/Statues-Statuettes/87091/PM-LEE-HSIENG-LOONG-STATUE.html,,
Minister of Foreign Affairs and Sailing,1248538507,,,,1,0,1,,Anti-gay Singapore prof cancels NYU stint after uproar - Yahoo! News,,,http://news.yahoo.com/s/afp/20090724/wl_asia_afp/singaporeuseducationgaysrights,,
,1251573325,,,,1,1,0,,Florist and online gift flowers shop Singapore,,,http://www.bloomlife.com/,,
,1252287781,,,,1,0,0,,Sales Assistants at Watson - Singapore Part Time Job,,,http://www.singaporeparttimejobs.com/retail-sales/sales-assistants-at-watsons-personal-care-stores-pte-ltd.html,,
,1254272691,,,,0,0,6,,Miss Singapore quits after criminal record revealed,,,http://www.dailytimes.com.pk/default.asp?page=2009%5C09%5C30%5Cstory_30-9-2009_pg9_7,,
,1254273348,,,,0,1,2,,"Singapore population nears 5 mln, immigrants rise.",,,http://in.reuters.com/article/worldNews/idINIndia-42774020090929,,
,1255056413,,,,0,0,6,,High-living Singaporean monk faces jail for fraud.,,,http://www.google.com/hostednews/afp/article/ALeqM5ivTUrYEboTkU6ihelNry7rDnyVRQ,,
,1255909848,,,,0,2,5,,"Sex and Love Please, Say Singaporeans",,,http://carnalnation.com/content/35206/930/sex-and-love-please-say-singaporeans,,
,1256342960,,,,1,0,0,,Singapore Map - Singapore Map Street Map City Map CBD Map,,,http://singapore.mapinhand.com/,,
,1256343783,,,,1,0,0,,Singapore Weather - Singapore Weather Weather Forecast,,,http://singapore.whetherweather.com/,,
Emeritus Senior Minister,1257085604,,,,1,0,0,,"Left Among the Dead: Migrant workers in Singapore isolated from society, living in dorms on cemetery grounds",,,http://theonlinecitizen.com/2009/11/social-isolation-left-among-the-dead/,,
Emeritus Senior Minister,1258372682,,,,1,0,1,,"Ex-political prisoner Dr. Lim Hock Siew: ""Government leaders say they have integrity that has to be sustained by the highest pay in the world but they demand from political opponents and detainees an integrity that has to be sustained by the longest imprisonment in the world""",,,http://www.youtube.com/watch?v=dqhr4wxUFws,,
perverted,1258432930,,,,0,0,2,,The Harold Lloyd Method of Mass Transit Advertising,,,http://www.skribeproductions.com/2009/11/16/the-harold-lloyd-method-of-mass-transit-advertising/,,
,1260771635,,,,1,0,1,,Chinese New Year Car Rental Singapore for year 2010,,,http://www.prlog.org/10450560-chinese-new-year-car-rental-singapore-for-year-2010.html,,
,1262884328,,,,1,0,1,,2010 Rolls Royce Ghost Released in Singapore today selling 250 units immediately. 'Baby Rolls' is a hit.,,,http://www.ozcarguide.com/news-reviews/auto-news/453-2010-rolls-royce-ghost-released,,
,1263287263,,,,1,0,1,[removed],"Hello la, I'm in Singapore for the week and want to go dancing, was wondering Zirca or Zouk, and which days?",,,https://www.reddit.com/r/singapore/comments/aokjz/hello_la_im_in_singapore_for_the_week_and_want_to/,,
,1264062078,,,,1,0,1,,Florist In Singapore | Singapore Flower Shop,,,http://www.onlinefloristsingapore.com/,,
,1264063410,,,,1,0,1,,Florist Singapore | Flowers,,,http://www.onlinefloristsingapore.com/blog,,
Emeritus Senior Minister,1267050877,,,,0,0,2,,A call to suspend all executions,,,http://theonlinecitizen.com/2010/02/toc-editorial-a-call-to-suspend-all-executions/,,
Emeritus Senior Minister,1267144836,,,,0,4,2,,"Barely two weeks after being investigated for insensitive comments on Buddhism, another video has surfaced of Pastor Rony Tan, this time targeting homosexuals.",,,http://www.straitstimes.com/BreakingNews/Singapore/Story/STIStory_492437.html,,
Emeritus Senior Minister,1267404912,,,,1,0,1,,The coming around of Chee Soon Juan and SDP?,,,http://theonlinecitizen.com/2010/02/the-coming-around-of-chee-soon-juan-and-sdp/,,
Emeritus Senior Minister,1267411155,,,,0,0,7,,Singapore has the biggest income gap among 23 rich nations surveyed,,,http://www.pressrun.net/weblog/2010/02/singapore-income-gap-prison-population-high-book.html,,
Emeritus Senior Minister,1268313355,,,,0,2,8,,"The number of homless people picked up around Singapore has doubled in the last 2 years. The Straits Times decides it's because of ""personal irresponsibility"". ",,,http://meltwaternews.com/prerobot/sph.asp?pub=ST&amp;sphurl=www.straitstimes.com//PrimeNews/Story/STIStory_499586.html,,
Emeritus Senior Minister,1268317414,,,,0,22,13,"There's been minimal activity on this subreddit for a while now, so I just wanted to know: who actually reads /r/Singapore? What would you like from this subreddit? I'm a Singaporean living outside the country at the moment, so I'd like this to become a better source of news and discussion. Hopefully, things will pick up. So everyone who uses this subreddit, post here so we know there actually *are* active redditors here. Maybe it'll encourage more activity.**Update**Glad to see there's some activity here. Now all we need to do is wait for something to *actually happen in Singapore*. ",Who uses /r/Singapore?,,,https://www.reddit.com/r/singapore/comments/bc2vv/who_uses_rsingapore/,,
,1268364940,,,,1,0,2,[deleted],Please leave Jack Neo and his family alone,,,https://www.reddit.com/r/singapore/comments/bccnr/please_leave_jack_neo_and_his_family_alone/,,
Emeritus Senior Minister,1268435633,,,,0,2,2,,"""Hymns from the Blazing Chariot"" - awesome HD video from Singaporean Death Metal band Rudra, directed by Jacen Tan {cross-posted from /r/metal}",,,http://www.youtube.com/watch?v=MVvDOTxEb_Q,,
Lost In Singers,1268451681,,,,0,3,6,,I Am A Singaporean Male Who Served As An Infantry Officer In Our Conscripted Armed Forces For More Than 2 years. AMA.[cross-posted from /r/IAmA],,,http://www.reddit.com/r/IAmA/comments/bbjc0/i_am_a_singaporean_male_who_served_as_an_infantry/,,
Emeritus Senior Minister,1268946206,,,,0,3,9,,Singapore's Blood Money: Hanging drug couriers but investing with their suppliers,,,http://www.singapore-window.org/1020naus.htm,,
Emeritus Senior Minister,1268965928,,,,0,0,3,"... I created [a last.fm group for us.](http://www.last.fm/group/Singapore%2B%252B%2BMetal)It's pretty half-assed right now, but I'm new at this. I'll try to improve it as people join.Feel free to [add me](http://www.last.fm/user/parmetheus), since I probably have better taste than you anyway.",Singaporean Metalheads....,,,https://www.reddit.com/r/singapore/comments/bfa03/singaporean_metalheads/,,
Emeritus Senior Minister,1269030196,,,,0,0,3,,The Anti-Mandatory Death Penalty Photo Project [facebook group],,,http://www.facebook.com/group.php?v=info&amp;ref=nf&amp;gid=389182508056,,
Emeritus Senior Minister,1269248862,,,,0,6,9,,City Harvest Church looking to buy $310m stake in Suntec,,,http://www.channelnewsasia.com/stories/singaporelocalnews/view/1045026/1/.html,,
Emeritus Senior Minister,1269521148,,,,0,0,3,,The Winning Streak Continues.,,,http://asiasentinel.com/index.php?option=com_content&amp;task=view&amp;id=2359&amp;Itemid=181,,
perverted,1269770960,,,,0,0,5,,A Curious Case of Censorship?,,,http://www.skribeproductions.com/2010/03/28/a-curious-case-of-censorship/,,
perverted,1269775077,,,,0,2,1,,Live Blogging: BarcampSG5,,,http://www.skribeproductions.com/2010/03/27/live-blogging-barcampsg5/,,
,1270225034,,,,1,0,1,,Attorney-General files charges against runaway Romanian Diplomat,,,http://www.todayonline.com/Singapore/EDC100402-0000092/AGC-levels-13-charges-against-Ionescu,,
,1270264713,,,,1,0,1,[deleted],State Of The Publishing Industry In Singapore | Online Media Gazette,,,http://omgzam.com/state-of-the-publishing-industry-in-singapore/,,
,1270657008,,,,0,7,4,"I was sound asleep at the time, but did anyone feel the quake here?  I think the epicenter was around 400 miles away which may be a bit far for that magnitude to feel.",Was the Sumatra Earthquake felt here?,,,https://www.reddit.com/r/singapore/comments/bnph8/was_the_sumatra_earthquake_felt_here/,,
,1270702401,,,,1,0,1,,"DBS MasterCard Platinum Card - Bank Credit Card, MasterCard Credit Card",,,http://www.dbs.com/sg/personal/cards/dbs_mc_plat/default.aspx,,
,1270703555,,,,1,0,1,,"DBS Classic Card - Travel Credit Card, Credit Card Information at DBS Singapore",,,http://www.dbs.com/sg/personal/cards/dbs_classic/default.aspx,,
Emeritus Senior Minister,1270728045,,,,0,0,6,,Raffles Hotel to be sold to Qatar,,,http://www.telegraph.co.uk/finance/newsbysector/retailandconsumer/7566098/Raffles-Hotel-to-be-sold-to-Qatar-for-275m.html,,
,1271832805,,,,1,5,5,anyone know where to find pictures of Brr Blobs?,"does anyone remember a type of ""ice lolly"" called BRR Blobs?  They had these in Singapore in the 70s...",,,https://www.reddit.com/r/singapore/comments/btz1q/does_anyone_remember_a_type_of_ice_lolly_called/,,
,1272716890,,,,1,15,8,"I went to Bangkok, Thailand for a holiday and the best thing that happened to me was stumbling upon a shady electronics/computers streetmarket in an underground labyrinth-like place in Chinatown. Bought some bizarre pirated handhelds and video game figurines.Does Singapore have anything like this? Shops, markets, meetings, anything...?","What to do in Singapore for a movie geek, video game nerd, headbanger, skateboarding, comic loving Redditor?",,,https://www.reddit.com/r/singapore/comments/bypkj/what_to_do_in_singapore_for_a_movie_geek_video/,,
,1272904878,,,,0,23,7,"A bit of background on myself: I'm a young filmmaker in his early 20s. Have quite a bit of experience in the industry from all different levels of productions. I love filmmaking and I'm not in it for the money. Barring the costs and special effects aside, what themes would you like to see explored in a local military-themed film?I've thought about the different issues I could explore such as homosexuality or the officer/NCO hierarchy. But I guess more views would be awesome.Another point I'd like to bring up is the general lack of support from people I've actually bounced ideas off. Most of the replies I get are the usual ""The government won't...."" and a friend even said, ""Most Singaporean males have served 2 years of National Service, and many of them can't wait to get out. Why would they even want to revisit their memories from the Army at all?""I guess the second question would be; ""Is there really that large of a hatred towards the military?""","/r/Singapore: I'm thinking of producing a war/soldier-themed short-film. However, I'm torn between the general lack of support for it from peers or ideas.",,,https://www.reddit.com/r/singapore/comments/bzhag/rsingapore_im_thinking_of_producing_a/,,
,1272960554,,,,1,0,1,,A Golden Investment That Sounds Too Good To Be True,,,http://www.dreamteammoney.com/index.php?showtopic=98214,,
doesn't wear shoes.,1273160608,,,,0,1,7,,"Singapore dog mill goes bust, 75 dogs used for breeding need to be rehomed.",,,http://dogmilllrehomers.blogspot.com/,,
,1273196983,,,,1,0,0,[removed],A Singapore Startup,,,https://www.reddit.com/r/singapore/comments/c0un2/a_singapore_startup/,,
Emeritus Senior Minister,1273403828,,,,1,0,1,,Interview with Singaporean Crust-Grind band Wormrot.,,,http://heavymetaltribune.blogspot.com/2010/05/interview-with-wormrot.html,,
Emeritus Senior Minister,1273412691,,,,0,8,12,,Facebook group: Mass Boycott Starhub/Singtel Overpriced World Cup Package,,,http://www.facebook.com/group.php?gid=117853164912683&amp;v=info,,
,1273738893,,,,1,0,0,,"New Tourist Video for Singapore - With so many things to see and do, Singapore can be anything you want it to be.",,,http://www.jonn.co.uk/movies/Video28.html,,
,1274270239,,,,1,0,1,[deleted],"TODAYonline|Singapore |Slower online surfing, at greater cost? - How worried are you guys about ACTA - Anti-Counterfeit Trade Agreement?",,,"http://www.todayonline.com/Singapore/EDC100507-0000057/Slower-online-surfing,-at-greater-cost?",,
,1275726033,,,,1,5,0,[deleted],Any one else hate it when people spell 'then' as 'den'?,,,https://www.reddit.com/r/singapore/comments/cbpjj/any_one_else_hate_it_when_people_spell_then_as_den/,,
,1276407153,,,,1,5,5,"I would like to travel around singapore by either a small yacht or canoe, how difficult is this?would I get run over by container ships or used as target practise by overzealous Malaysians or Singaporean navy?If anybody has done this can they point to somewhere I could buy or rent a canoe or small sailing dingy. ",how can I travel around singapore by sea,,,https://www.reddit.com/r/singapore/comments/ceg25/how_can_i_travel_around_singapore_by_sea/,,
Bishan ST 11,1276650268,,,,0,0,9,,S'pore on watch list,,,http://www.straitstimes.com/BreakingNews/Singapore/Story/STIStory_540427.html,,
Lost In Singers,1276662835,,,,1,2,0,,What Is This CommunicAsia Booth Babe Wearing? Is That Supposed To Be A Skirt?,,,http://communicasia2010.posterous.com/booth-babe-at-communicasia-2010,,
Ministry of Foreign Eclairs,1277117757,,,,0,12,14,"Tried at my friend's house, majority of imgur images simply refuse to load. ",Singapore Users: Anyone else having problems loading images from imgur.com? Seems like Singtel users are affected,,,https://www.reddit.com/r/singapore/comments/cha8j/singapore_users_anyone_else_having_problems/,,
Bishan ST 11,1277140013,,,,1,2,0,Does anyone else face the same problem in singapore?,I can't access imgur link from starhub and singnet,,,https://www.reddit.com/r/singapore/comments/che88/i_cant_access_imgur_link_from_starhub_and_singnet/,,
old man,1277205645,,,,0,9,9,"Change the URL of the link.. add a ""i."" in fronteg. http://imgur.com/ImSfx.jpg  --&gt; http://i.imgur.com/ImSfx.jpg",Solution to imgur.com for Singtel users..,,,https://www.reddit.com/r/singapore/comments/chov3/solution_to_imgurcom_for_singtel_users/,,
Lost In Singers,1277254927,,,,0,5,10,,"Punggol to be a ""Mini-Sentosa"".  The following comment says it all, really.",,,http://www.todayonline.com/Singapore/EDC100623-0000058/Punggol-to-be-a-mini-Sentosa-in-the-backyard,,
the foreign talent,1277781789,,,,0,15,11,,"As a redditor, what do you think about STOMP?",,,https://www.reddit.com/r/singapore/comments/cjzwu/as_a_redditor_what_do_you_think_about_stomp/,,
Bishan ST 11,1279332892,,,,0,6,4,,Big drain not working,,,http://www.straitstimes.com/BreakingNews/Singapore/Story/STIStory_554647.html,,
out of town again,1279530282,,,,0,3,7,,Government to spend S$1m to pretend to give a damn about cyclists,,,http://www.straitstimes.com/BreakingNews/Singapore/Story/STIStory_555274.html,,
out of town again,1279537008,,,,0,0,13,,"Alan Shadrake, author of a book alleging double standards in Singapore's application of the death penalty, has been arrested by Singapore police",,,http://news.smh.com.au/breaking-news-world/singapore-arrests-british-author-20100719-10gak.html,,
out of town again,1279704744,,,,0,3,7,,Malaysians signing petition to plead for clemency for Malaysian facing death penalty for drug trafficking,,,http://www.malaysiakini.com/news/137961,,
out of town again,1279782824,,,,1,0,0,"I don't think I will just yet, though I'm itching to get my own soon.",iPads will be sold here starting tomorrow! Anyone planning to buy one?,,,https://www.reddit.com/r/singapore/comments/csdab/ipads_will_be_sold_here_starting_tomorrow_anyone/,,
Emeritus Senior Minister,1280148507,,,,0,6,5,,Singapore's suicide rate rising (at least 401 in 2009),,,http://health.asiaone.com/Health/News/Story/A1Story20100726-228959.html,,
,1281354121,,,,1,9,3,,"I'm thinking about spending 5 days or so in Singapore from about the 15th of January. Never been before, where should I stay/what should I do? (Not really from North Korea!) ",,,https://www.reddit.com/r/singapore/comments/cz1ej/im_thinking_about_spending_5_days_or_so_in/,,
,1281359806,,,,0,8,8,,Singapore's 45th National Day - birthday greetings from A Singaporean in London,,,http://www.singaporeaninlondon.com/2010/08/singapore-45th-national-day-london.html,,
,1281404229,,,,1,1,0,,"LKY's ""Intellectual class"" driving Singapore into the ground",,,http://utwt.blogspot.com/2010/07/lee-kuan-yews-intellectual-class-will.html,,
out of town again,1281713076,,,,0,9,12,,Does anyone outside of Singapore even know or care that the Youth Olympic Games is going on now?,,,http://www.reddit.com/r/AskReddit/comments/d0t18/hey_reddit_does_anyone_outside_of_singapore_even/,,
Bishan ST 11,1282267760,,,,1,3,0,Wow :D,I got cake!,,,https://www.reddit.com/r/singapore/comments/d398e/i_got_cake/,,
,1282291366,,,,1,0,0,[deleted],So.. we're kinda like STOMP but much more civilised right?,,,https://www.reddit.com/r/singapore/comments/d3cz1/so_were_kinda_like_stomp_but_much_more_civilised/,,
,1282312647,,,,1,0,1,,Who really benefit with rising HDB flat prices,,,http://furrybrowndog.wordpress.com/2010/07/14/who-really-benefits-from-rising-hdb-housing-prices/#comment-378,,
Thinks 'fantasy island' was the bees knees,1282659638,,,,0,5,6,,SDP calling netizens: Help us win Bukit Panjang,,,http://yoursdp.org/index.php/news/singapore/4055-sdp-calling-netizens-help-us-win-bukit-panjang/,,
,1282672733,,,,1,0,0,[deleted],Remember when Singapore went bankrupt and all its money became obsolete?,,,http://singaporemichiganobsoletebanknotes.com/,,
,1282754731,,,,1,0,1,,Preparing For A.C.M.E II and FAQs,,,http://blog.sgcafe.com/2010/08/preparing-for-a-c-m-e-ii-and-faqs/,,
,1283226537,,,,1,9,10,"I had recently switched to Starhub from Singtel. I was ok with the fact that they told me that they would port my number in 7-10 days. But after the tenth day, I realised my number still wasn't ported. I made a call to them regarding this and they gave the silly excuse that they're undergoing some system upgrade/maintainence. So I waited and waited. Finally they sent me a text saying that my number has been ported successfully. Problem solved? Not quite.I found out that I could make outgoing calls and send outgoing text. But neither incoming calls nor text are working for me. It's been 7 days and counting that I'm living with this problem.Their customer service has been giving me the run around; Each time I gave them a call, their response is always one of these: 1)We would check on the problem and give you a call back, which they never did. 2) We have resetted your line and it would work in 24hrs. Yea, right, we're still here aren't we.I'm contemplating going down to their service centre to cancel my service with them and return the phone for a full refund. I have been with Singtel and M1 and I have to say, this is really, really atrocious. How could you let your customer not be contactable for a week and blame all this on system upgrades? I really think some thing is wrong with their customer service and I don't think I will ever use them nor will I recommend them to my family and friends. Not after I describe to them my ordeal.What a nightmare!",Switching to Starhub was a big mistake.,,,https://www.reddit.com/r/singapore/comments/d7js6/switching_to_starhub_was_a_big_mistake/,,
,1283350949,,,,0,7,11,,Next Generation Nationwide Broadband Network Up to 1GB from M1 Singapore,,,http://m1.com.sg/fibre/index.html,,
,1283425256,,,,1,0,0,,Tesco may be taking over Carrefour in Singapore ,,,http://www.ft.com/cms/s/0/59000eda-b5cc-11df-a65e-00144feabdc0.html,,
out of town again,1283492398,,,,0,2,5,,Rewarding our foreign workers for their hard work,,,"http://www.todayonline.com/Singapore/EDC100903-0000093/Work-and-play,-the-Hexagroup-way",,
,1283636179,,,,1,0,1,,5 things to bring for Singaporeans in London if you are flying from Singapore to London,,,http://www.singaporeaninlondon.com/2010/09/things-to-bring-singaporeans-london.html,,
,1283658729,,,,1,0,0,,Ideal Tuition: Singaore Home Tuition Agency,,,http://www.idealtuition.com,,
,1283736643,,,,0,0,0,,Hitler Finds Out about his National Service Recognition Award ,,,http://www.youtube.com/watch?v=SYEcpqMRXSY,,
,1283826448,,,,0,9,5,"I read day in day out the newspapers in Singapore and constantly get the impression that Singaporeans are like bible-belt conservatives. From their over-reliance on ""authorities"" to keep out undesirables to their stance on immigrant competition. Is that actually the case?",Do you believe that Singaporeans are actually reactive and conservative?,,,https://www.reddit.com/r/singapore/comments/dafbf/do_you_believe_that_singaporeans_are_actually/,,
,1284542630,,,,0,14,8,,The Singapore government has been recommended that mandatory internet filters be implemented to assist parents in controlling content.,,,http://www.channelnewsasia.com/stories/singaporelocalnews/view/1081382/1/.html,,
,1284608637,,,,0,6,10,"Athena D'Souza, a stay-at-home mom who goes online as often as her 17-year-old son, knows the dangers of the Internet. She welcomes the report's recommendation for Internet filters to be made easily available. But she said: ""Suppose I'm a parent who wants to use the filters and will do so responsibly. How do I know my children's friends' parents have the same kind of viewpoint and they have the filters in their house?....I'm not in control when they (my children) are in somebody else's house. If you can enforce those filters in everyone's house, then that will be good."" It's the common attitude of Singaporeans that sucks. How in the world do you get the kahunas to dictate what your neighbour sees and views.",From the article about internet filters: A Singaporean's viewpoint,,,https://www.reddit.com/r/singapore/comments/deip5/from_the_article_about_internet_filters_a/,,
Bishan ST 11,1284611247,,,,1,2,1,,Circle Line's go where,,,http://www.smrt.com.sg/trains/circle_line_attractions.asp,,
,1284631164,,,,1,0,1,,Malaysian upset with Singaporeans for not following rules ,,,http://news.asiaone.com/News/AsiaOne%2BNews/Malaysia/Story/A1Story20100916-237456.html,,
,1284631215,,,,1,0,1,,A high-speed chase involving a lorry believed to be stolen resulted in a crash along the Ayer Rajah Expressway (AYE) towards Tuas,,,http://www.channelnewsasia.com/stories/singaporelocalnews/view/1081634/1/.html,,
,1285150927,,,,0,3,3,,"Man charged with cutting state, YOG flags ",,,http://www.channelnewsasia.com/stories/singaporelocalnews/view/1082686/1/.html,,
,1285162671,,,,0,0,5,,An informal group has been formed in Singapore to help netizens understand their rights and responsibilities on the Internet.,,,http://www.channelnewsasia.com/stories/singaporelocalnews/view/1082744/1/.html,,
,1285432894,,,,1,0,1,[removed],"Hey, Singapore.",,,https://www.reddit.com/r/singapore/comments/dis9u/hey_singapore/,,
,1285657610,,,,0,7,5,[deleted],"Holidaying in Singapore, one month, have questions please.",,,https://www.reddit.com/r/singapore/comments/djvpe/holidaying_in_singapore_one_month_have_questions/,,
,1285730885,,,,0,4,19,,YOG volunteers get F1 ticket a day after the race,,,http://www.todayonline.com/Voices/EDC100929-0000057/YOG-volunteer-got-F1-ticket-a-day-after-the-race,,
,1285759062,,,,1,0,0,,Crowds of the faithful for the relics of Padre Pio in Singapore,,,http://www.visitsangiovannirotondo.com/en/single_news.php?id=476,,
