author_flair_text,created_utc,downs,likes,name,no_follow,num_comments,score,selftext,title,ups,upvote_ratio,url,view_count,comments
,1303358119,3,,t3_gv1nk,,9,12,"Pretty much what I feel about the the upcoming elections as well...As a fellow friend also says, ""I am still thinking of how to broach the topic of politics with my parents. They have always been staunch supporters of the PAP. In fact, they have warned me against voting against the Government before, because they erroneously believe there will be ""consequences"" if I did so. But I have long shed whatever illogical fears I have had inside me. And I shall tell them, if it ever comes to pass, that while they may be voting for whatever they've gained from the incumbent in the past, I'll be voting for the future instead. My future.""","""Is this the start of Singapore's decline?""",15,,http://www.reddit.com/r/singapore/comments/gv1nk/is_this_the_start_of_singapores_decline/,,"|Bravo|Thank you so much! :) Lets hope our generation knows what to do!|well said. i do also feel this overall sense of 'how do i explain things to the older generation?' i followed a young politician on a walkabout, and while he didnt talk to many people, the people he did talk to did make me worry greatly too about the upcoming elections. people were afraid to even take his political party's pamphlet from him (as if the party's banhammer will emerge from a random somewhere to smite them), and the ones that dared speak up said things that were simply untrue - like how the straits times is to be taken at their word, and how the opposition parties are downright incapable.but if i really think about it, i'm actually privileged that i have had the chance and resources to widen my perspectives. i've been through an education which has opened my eyes to the partiality of the media in singapore, and i've had the benefit of discovering a wealth of alternative news websites and bloggers with alternative views. i may not agree with them always, but my other privilege could also be that i've also had the benefit of developing critical thought to be able to discern the right from wrong for myself, and that i've had parents who've drummed in a deep sense of cynicism for the establishment and the man from a young age. (haha.) if it will help alleviate any despair on our generation's part, i think we must recognise that our (at least the people on reddit, twitter and teh internets in general) advantage in this election is our access to *alternative* information, and that we can and maybe should pass on this information to the people around us. they may not take us at our word, but that doesn't mean we shouldnt try at all. i believe there is a deep sense of unease even in the older generation, about whats happening to singapore (eg. immigration, prices of things, etc), and the mainstream media paints too pretty a picture for your average auntie and uncle to stomach. on a side note, this is perhaps my way of putting my money where my mouth is, but my friends and i run a sort of online magazine kind of thing, and we're in the process of coming up with a pdf, a site and maybe an rss type resource which our generation can hopefully pass on to our other friends and older generation relatives not in the know. if /r/singapore is keen, i'll be happy to share the link (but only if /r/singapore is keen). we've been called idealists, artists and unrealists but i feel quite strongly about this to at least do this little bit - i dont want to regret not doing anything with the skills i sort of have, when i could have done so.anw, about voting against the government, an article was tweeted around yesterday about voting secrecy. it's written by the workers party and details the process of voting, and what happens to the ballots after. i've heard myself, the urban horror stories of people who've voted against the government, but this article did quell this fear a little in me as the WP said themselves, ""The Workers’ Party has participated in every General Election since the independence of Singapore. Based on our experience, we are certain that the vote is secret."" for your reference: http://wp.sg/wpge/your-vote-is-secret-3/**tl;dr: YOU, person on the internet, have access to alternative information. give a shit, share!***p/s: sorry for the wall of text!*|I can understand why people from that generation would want to vote PAP. It's cliqued to say this but Singapore really did go from a third world country to a first world in a short space of time and the old man Lee Kuan Yew certainly had a role in that. As for Singapore's future, I imagine it will slowly get more democratic. There is certainly a chance that it won't but at the moment it's taking baby steps in that direction. Economically Singapore is in ship shape. It understands the consequences of globalization and one of the few countries truly prepared for it. "
,1303346618,2,,t3_guxhn,,0,0,,I'm surprised this has not been discussed.,2,,http://forums.asiaone.com/showthread.php?t=38579,,|[deleted]
,1303345640,2,,t3_gux4f,,13,8,For obvious savings on shipping.,Anyone interested in bulk ordering reddit and xkcd tshirts and other merchandise ? ,10,,http://www.reddit.com/r/singapore/comments/gux4f/anyone_interested_in_bulk_ordering_reddit_and/,,"|Yes I'm interested!|[deleted]|I'm in.|YES. more info pl0x|yes, more info|don't bother, most of the reddit shirts are backordered and it's gonna be a very long wait.|So how do we go about doing this ? Any suggestions ?|I need to find a way to order ThinkGeek stuff in Singapore :&lt;|Mmm. I'm keen. Lemme know what the plans are...|I ordered reddit stuff from redbubble.com. They were pretty great, they print after you order but they're still pretty prompt. I bought stickers and tshirts; took about 3 weeks to arrive. Let me know if y'all are ordering, I don't mind getting more stuff.|I'm not, but I have a question, this seems like a good place to ask.  I ordered 2 Reddit flash drives last week, and only received one.  I really can't find anyway to contact XKCD store for this, the second was really to give to the person who introduced me to Reddit.  Anyone have any ideas?"
,1303590633,2,,t3_gvwn5,,6,2,"On the [elections department website](http://www.elections.gov.sg/voters_register.html) it says: ""Registration will remain open until such time when the writ for an election is issued, and will be resumed only after the election."" From what I understand the writ for election was issued on April 19th... Does that mean it's too late to register? I might be misunderstanding something here. Any clarification welcome!!",Is it too late to register as an overseas voter?,4,,http://www.reddit.com/r/singapore/comments/gvwn5/is_it_too_late_to_register_as_an_overseas_voter/,,"|I'm afraid so. I can't read it otherwise. Moreover, from my experience, getting registered as an overseas voter takes a few weeks (from the time I submitted my online application to the time I got the physical confirmation letter), so even if you can register now, the paperwork might not get through in time.|you had 5 years to register|where are you based, btw?"
,1303548847,0,,t3_gvn5b,,4,9,,"Found this interesting blog post - ""An Email from a Moulmein resident about PAP's Lui Tuck Yew.""",9,,http://singaporeelection.blogspot.com/2011/04/paps-lui-tuck-yew-not-connecting-with.html?utm_medium=twitter&amp;utm_source=twitterfeed,,"|anyone against them online are trollsagainst them irl, hecklers|This is the Internet, no time stamps, no addresses equals not true by default. Hearsay and personal attacks detracts the public from really important issues. |If this is true, it's hilarious - he didn't answer why the author should vote for him, even during the email exchange."
,1303530651,1,,t3_gvio2,,1,12,,PM Lee: Foreigners help create more ‘good’ jobs for Singaporeans,13,,http://www.temasekreview.com/2011/04/21/pm-lee-foreigners-help-create-more-‘good’-jobs-for-singaporeans/,,|[deleted]
,1303755669,2,,t3_gx52m,,8,5,So how is it? Are/is there:* Networking events* Angel Investors* Venture Capital funds* Good people to hire* People who are prepared to work for a below market salary but compensated extra with equity stakes/stock options.* Cheap Offices* Government Help* A 'help each other out' friendly community* Developers/ Software Engineers (there is a shortage everywhere)?,What's the Tech Startup scene like in Singapore?,7,,http://www.reddit.com/r/singapore/comments/gx52m/whats_the_tech_startup_scene_like_in_singapore/,,"|nothing is cheap in singapore| People who are prepared to work for a below market salary but with equity stakes/stock optionswhy would anyone do that?|there's nothing much going on in the tech startup scene in singapore. |[deleted]|Lemme try to answer this as best I can:&gt; Networking eventsYep, there are industry networking sessions, or depending on your area of interest, smaller groups that get together to share ideas (EG: FLEX user groups etc).&gt; Angel Investors Venture Capital fundsYes, if you have a compelling idea, you should be able to find the money.&gt; Good people to hireYes, the standard of education in Singapore is high, but as always to find the right person takes time.&gt;People who are prepared to work for a below market salary but &gt;compensated extra with equity stakes/stock options.Possible, but Singaporeans are pragmatic, and may not be so keen to take a job that is heavily weighted to options.&gt; Cheap OfficesThey exist, but are quite far out of town. Office rental is quite expensive. I started my company in the spare room in my apartment, until I could afford renting a ""real"" office.&gt; Government HelpDefinately. There are a number of grants available to startups, that typically co-fund projects in areas that the Govt is keen to grow Singapore's expertise. If you're in Tech, then maybe the first place to start is [IDA](http://www.ida.gov.sg), but there are other govt agencies that provide funding also - eg: for IP creation or expansion to new markets.&gt; A 'help each other out' friendly community Developers/ Software Engineers (there is a shortage everywhere)I think you'll be able to find small pockets of engineers that organise get-togethers, but then again, we use the web as our support team anyway. Hope this helps.(edit:Formatting).|There are a lot of angels in Singapore. Major problem is in 2nd Tranche (the 1-5 M mark and the 5-10 M mark). In general we don't need that much funding as compared to a SV start-up because of lower wages and ease of operations. The start-up I work for had a burn rate of around 50K/month prior to acquisition with a team of around 20 (based in Singapore and India).There is a friendly community, come for Echelon in June (it's unconference renamed). Developers are tough to find (good ones)"
Everything Needs More Tits!,1303742003,2,,t3_gx081,,2,6,,who ever made this. thank you.,8,,http://i56.tinypic.com/206lbvc.jpg,,"|[deleted]|thanks, this made my day!|[relevant](http://t1.gstatic.com/images?q=tbn:ANd9GcTpdzfWuByyJ4MnIwD2z7RtmJnoY7ZL4uK1j4Jx-uhGqZcMWBeyaQ&amp;t=1)"
,1303735358,2,,t3_gwy9e,,4,0,,"WTF?! Only date ACSi boys, says relief teacher. Chinese High and RI guys are 'ugly'?? ",1,,http://singaporeseen.stomp.com.sg/stomp/sgseen/what_bugs_me/609874/only_date_acsi_boys_says_china_relief_teacher.html,,"|I know this is rather old news but I'm curious to know what Redditors thought of it.Personally, coming from an All-Boys school, I think she's just a shallow bitch. ;DOh and I overheard an uncle at the market calling her a f'ing slut.|but from experience, ACS boys are cuter...(this comment is half in jest)|don't degrade reddit with crap from stomp"
,1303734446,0,,t3_gwy0o,,0,1,"I know this is rather old news but I'm curious to know what Redditors thought of it.Personally, coming from an All-Boys school, I think she's just a shallow bitch. ;DOh and I overheard an uncle at the market calling her a f'ing slut.","Only date ACSi boys, says relief teacher. Chinese High and RI guys are 'ugly' ??",1,,http://www.reddit.com/r/singapore/comments/gwy0o/only_date_acsi_boys_says_relief_teacher_chinese/,,
as seen on STOMP,1303732173,0,,t3_gwxj5,,0,7,,Party flags flouting Parliamentary Elections Act?,7,,http://sg.news.yahoo.com/blogs/singaporescene/party-flags-flouting-parliamentary-elections-act-065554766.html,,
*badum-tish*,1303722137,0,,t3_gwvnk,,2,11,,Tin Pei Ling: New blood or bad blood?,11,,http://veryfinecommentary.tk/articles/tin-pei-ling-new-blood-bad-blood/,,"|Upvote because this was written by a JC student, and also because it was a really good read I came across this morning that I happened to lose.|If she is suppose to represent the best of our nation's youth, we are doomed ..."
your mother horse,1303722051,1,,t3_gwvmv,,2,2,,For People. For Nation. For Future.,3,,http://www.youtube.com/watch?v=5uGrX86R2vM,,|For pony!|Whoever filmed and edited that film was a little stuck in the 1980's. And that elevator music **Shudder**
Pfft Tee,1303705582,1,,t3_gwrf0,,0,4,,Singapore Pte Ltd – a letter,5,,http://theonlinecitizen.com/2011/04/singapore-pte-ltd-–-a-letter/,,
Thinks 'fantasy island' was the bees knees,1303831673,2,,t3_gxtud,,2,1,,Singapore authorities arrest man for threatening to burn his voting slip... whatever happened to spoiling the ballot?,3,,http://www.straitstimes.com/GeneralElection/News/Story/STIStory_661416.html,,"|You can be arrested for chewing gum, and fined for not smiling at tourists.Welcome to Singapore.|Quit the drama queen act.  He threatened to burn the ballot box thus voiding other legit votes. The guy is a dumbass and deserved to be arrested. "
,1303809531,0,,t3_gxnji,,10,2,"Hi i'm looking for an isp in singapore that doesn't network shape or restrict/block ports.  I signed up for Starhub but they've been attrocious, for the few days i've had there service it's not worked.  So i'm heading back to return it.Before i dive in a sign up for another service i thought i'd ask here for some advice.I'm a heavy net user :)Thanks",Best Isp?,2,,http://www.reddit.com/r/singapore/comments/gxnji/best_isp/,,"|singnet and starhub both shape in the peak periods. for singnet i know after 1am the shaping stops and i get good speeds.i was a starhub user up until 5 years ago, and the family decided to switch to singnet after, and singnet does feel like they are faster.but compared to the speeds i get living in australia, singnet and starhub are absolutely terrible.|M1.  100Mbs for about $40 a month.|If you've got a fibre optic connection available for your house then by all means get one!"
,1303807975,4,,t3_gxn92,,2,36,,Nicole Seah's stance on Section 377a,40,,http://i.imgur.com/XXgxf.png,,"|Link: http://www.facebook.com/note.php?note_id=141136845957395|And yet, she still fails to give a definite stand on the issue. I applaud her use of the issue to bring up questions on housing costs and etc, which are important as well, but the fact remains that 377a infringes on basic rights. Furthermore, as an extension of the housing issue, what about the many homosexual couples who are unable to get public housing due to restrictions based on the so-called nuclear family."
,1303804723,0,,t3_gxmll,,4,2,"Hey r/SingaporeI just moved here and am looking to start playing some music.  I am a bass player.  PM me or post here if you want to jam or know a place I could look for people to play with.  I am into DnB, Electronic, Funk, Jam, and any mixture (really anything but Punk/Death Metal/etc...).  I know diatonic theory and am pretty good at just picking up and jamming but I can't play Jazz, so not looking for straight Jazz players, though I'd be happy to jam with Jazz players if they are open to it (and am willing to learn if you want to teach me some stuff)Let me know.  In the meantime I will be enjoying your delicious cuisine.",Musicians in Singapore?,2,,http://www.reddit.com/r/singapore/comments/gxmll/musicians_in_singapore/,,"|I play the bass too - but only on occasion. you'll have some luck looking for bandmates on www.soft.com.sg - it's a local music forum. I say some cos a lot of the kids on there are kids, and a lot prefer to play metal, punk and covers.good luck looking though! :)edit: I read diatonic as dianetic and did a disappoint face for a split second. oops. |I can't play the radio, but welcome and enjoy the food...|[deleted]|I play bass too, but I'm currently residing overseas. Have fun in Singapore. I remember the days I had rehearsals every night of the week. Fun times!"
,1303803370,3,,t3_gxmas,,3,17,"I need your urgent advice about employing a maid. As a busy mother, I need someone reliable to help out at home. My maid is from Profits Agency Pte (PAP) and she has worked for me for a long time. Her mother worked for my parents and did an excellent job, so I had faith in her. For several years her performance has been very good, but recently she has become arrogant and insensitive, and is making lots of mistakes. For example:1)     She flooded my kitchen –  she told me that the drain pipe has blocked (she was supposed to clear it once a month but didn’t). Then she assured me that it is very rare and won’t happen again in the near future. Guess what? It flooded again within a year!2)     She didn’t close a window and my terrier dog escaped. I was so worried cos he is dangerous and could bite lots of people. After the incident, she didn’t apologise and just shrugged her shoulders saying “What to do, it has happened.” Fortunately my neighbor found the dog and we locked it up again. 3)     Without consulting me, she has been bringing in strangers for my house's maintenance work. She says they charge low wages and keep costs down, but they eat my food, make a lot of noise and rest on my bed. I think they even tried to seduce my husband. It stopped feeling like my home, more like a cheap hotel, and I don’t always want to come back at the end of the day.4)     When she first came to work for me, I instructed her to clean the different parts of the house at least once a week. But for some time she has stopped taking care of the bedrooms of PP and H; they are now dirty and messy. I asked why and she told me that the kids had been disobedient, so she was neglecting their bedrooms as a punishment (she has forgotten that she is paid to clean all the rooms).  Even though my maid has worked for me for many years and I value what she has done in the past, I think she is now getting complacent.  Her attitude is imperious and dismissive. She ignores my comments and basically treats my feedback as ""noise"".  I wrote to the agency about her behavior; they assured me that they are the best agency around and all their maids are “Commited to Serve” – but I think it is just rhetoric and I don’t see that in her actions. Her salary is much higher than maids in other countries, but the agency say this is to keep her honest and stop her moving to another employer. They say there is a limited supply of maids, and Singapore isn’t big enough for more than one good maid agency, so I should not trust their competitors. I have to decide whether to renew my maid’s 5-year employment contract. When we discussed this she said that she is now part of a team, and if I want her I must also accept her friends doing part-time work for me. One friend is very inexperienced, can't do basic tasks or explain what she intends to do. I suspect that she is actually underage. When interviewed, she only seemed interested in her days-off and visiting Universal Studios. When she couldn't answer my questions she stomped her foot and exclaimed, ""I don't know what to say!"" But I am still expected to pay her a high salary. Now there happen to be a few other maid agencies - Workhard Pte (WP), New Solutions Pte (NSP), Super Personnel Pte (SPP) and Star Domestica Pte (SDP) - that offered me some helpers who seem sincere, genuine and intelligent. They are keen to work, willing to assist me and have a good attitude. I know that they may take a bit of time to learn how everything works, but frankly I am inclined to give them a chance. People say that the devil you know is better than one you don’t. But I feel that I can’t tahan my current maid anymore. Do you think I should sack my current maid and try out a new one? Appreciate your advice.Taken from: http://www.facebook.com/notes/ming-lee-lim/which-maid-to-choose/10150247540253273",Which maid to choose? by Ming Lee Lim ,20,,http://www.reddit.com/r/singapore/comments/gxmas/which_maid_to_choose_by_ming_lee_lim/,,"|Probably speak to her, find out whats happening with her life, tell her about your issues in a diplomatic way (she is a human being too), ask her what she needs to be able to her job better. Money, time-off, new clothes. Your lucky if she isn't working as hard as she used to due to some external problem (that can be easily remedied). Your screwed if her attitude has changed for the worse, permanently.But there is no way to scope this out until you talk to her. Also, doing this talk in different environment to her workplace (your home) might help - a local cafe etc5 year employment contract is too long. Negotiate and they will budge.Let me know how it goes. The Maid Management Consultant"
,1303797796,0,,t3_gxkua,,0,2,"Hey, my company is looking for a web developer for relatively long term.  If you are interested PM me or post here. Edit: Job Description**Title**: Web Developer (PHP focused)**Role**:* Focus on server-side engineering and architecture while interfacing with front-end design teamsPPRequirementsPP:* Experience coding in PHP* Experience working with MYSQL* Knowledge of localization (l10n) and Internalization (l18n) practices* Experience working with Windows Servers (IIS6 and IIS7)* Knowledge of server and network security issues.**Pluses*** Knowledge of Wordpress* Knowledge of design patterns like MVC* Knowledge on Python* Basic knowledge of English ",Need a job?  PHP/Web Dev,2,,http://www.reddit.com/r/singapore/comments/gxkua/need_a_job_phpweb_dev/,,
,1303786515,2,,t3_gxh0e,,5,24,,"So what if he's gay, TNP? ",26,,http://i.imgur.com/1QkYU.jpg,,"|If he can bring us to a better state then now, who cares if he's gay or not?! |Trololololololololol|[deleted]|pap smear|The sadder part of this issue is that my dad is exactly the type of person - one with homophobia or similar - that the PAP hopes to influence by putting this issue forth, and there's a high chance that Wijeysingha may contest in my GRC. I'm afraid that he will be more convinced to vote for the PAP as a result just because the opposition party is, according to what the MSM has informed him, fielding a homosexual candidate and is supporting the repealing of 337A. "
,1303884501,3,,t3_gyf0k,,1,16,,"Vincent Wijeysingha: ""The day when a politician threatens his electors with the army is the day when that politician has outlived himself. The army is our army, yours and mine, and I will not be threatened by anyone that my own army will be used against me.""",19,,http://imgettingpersonal.blogspot.com/2010/11/vincent-wijeysingha-i-will-not-be.html,,"|&gt; ""Without the elected president and if there is a freak result, within two or three years, my personal army would have to come in and stop it"" -- MM Lee Kuan Yew on what would happen if a profligate opposition government touched Singapore's vast monetary reservesFrom wikiquotes. Which currently says citation needed.Sorry, he is referring to his own personal army.Please get your own personal army, available at your nearest NTUC. Jokes aside though, the reason why citation needed is there because it seems to be taken out of context, and  is not exactly credible. The correct context is herehttp://catherinelim.sg/2009/09/03/sir-would-you-send-in-the-army/Scoured the net and found this to be the most relevant. I mean, yeah, that is a *great* quote by Vincent, bet the people in egypt/libya love it, but its not relevant, and as MM lee has said the opposite. I'm not a PAP supporter, but I hate anti-pap sentiments for the sake of simply being anti PAP. Anti PAP Propaganda is still Propaganda all the same."
